https://npidb.org/organizations/ambulatory_health_care/dental_261qd0000x/1366957995.aspx,Rodeo Dental Health Lbn R Hayashi Dds Inc,-,"301 Railroad Ave Rodeo, Ca 94572-1126",Rodeo,CA,510-455-7486,New,-,R Hayashi Dds Inc,Caroline Devereux - (accountant),12/05/2017,03/17/2018,Org
https://npidb.org/organizations/ambulatory_health_care/dental_261qd0000x/1598113789.aspx,Rodney L. Cobb,-,"818 W Alondra Blvd Compton, Ca 90220-3500",Compton,CA,310-632-2113,New,-,Rodney L. Cobb,Rodney Cobb - (dentist/owner),05/27/2016,06/13/2016,Org
https://npidb.org/organizations/ambulatory_health_care/dental_261qd0000x/1427380617.aspx,Rodney P Burton Dds Inc,-,"75 Long Ct Thousand Oaks, Ca 91360-6039",Oaks,CA,805-494-1500,New,-,Rodney P Burton Dds Inc,Rodney Burton - (president),02/12/2010,02/12/2010,Org
https://npidb.org/organizations/ambulatory_health_care/dental_261qd0000x/1265606370.aspx,"Rodolfo A Lucar Dds,prof.dental Corporation",-,"3414 W Ball Rd Ste K Anaheim, Ca 92804-3726",Anaheim,CA,714-821-8329,New,-,"Rodolfo A Lucar Dds,prof.dental Corporation",Rodolfo Lucar - (owner),04/18/2008,04/18/2008,Org
https://npidb.org/organizations/ambulatory_health_care/dental_261qd0000x/1891268850.aspx,"Rodriguez Cruz Dental, Inc.",-,"14323 Ramona Blvd. Baldwin Park, Ca 91706",Park,CA,626-962-8160,New,-,"Rodriguez Cruz Dental, Inc.",Alberto Rodriguez Cruz - (president),01/02/2019,01/02/2019,Org
https://npidb.org/organizations/ambulatory_health_care/dental_261qd0000x/1659569499.aspx,Roger D.sohn Dds,-,"24950 Redlands Blvd Suite B Loma Linda, Ca 92354-4032",Linda,CA,909-478-9777,New,-,Roger D.sohn Dds,Roger Sohn - (owner),10/05/2007,10/05/2007,Org
https://npidb.org/organizations/ambulatory_health_care/dental_261qd0000x/1558984815.aspx,"Roger W.k. Joe, Dds Inc",-,"17437 Chatsworth Street Granada Hills, Ca 91344",Hills,CA,818-368-6694,New,-,"Roger W.k. Joe, Dds Inc",Roger Joe - (owner/president),05/21/2020,05/21/2020,Org
https://npidb.org/organizations/ambulatory_health_care/dental_261qd0000x/1437709706.aspx,Rohit Basson Dds Inc,-,"1282 N Lake Ave Pasadena, Ca 91104-2854",Pasadena,CA,626-797-3451,New,-,Rohit Basson Dds Inc,Rohit Basson - (dentist),09/18/2019,09/18/2019,Org
https://npidb.org/organizations/dental_health/general-practice_1223g0001x/1457587495.aspx,Roland Markarian Dmd A Dental Corporation,"A general dentist is the primary dental care provider for patients of all ages. The general dentist is responsible for the diagnosis, treatment, management and overall coordination of services related to patients' oral health needs.","1011 E Avenue J Lancaster, Ca 93535-3839",Lancaster,CA,661-948-8100,New,-,Roland Markarian Dmd A Dental Corporation,Roland Markarian - (chief Executive Officer),06/04/2009,01/17/2019,Org
https://npidb.org/organizations/ambulatory_health_care/dental_261qd0000x/1144835398.aspx,"Rolinda Harsany, Dds, Inc",-,"3030 Beard Rd Ste A Napa, Ca 94558-3446",Napa,CA,707-255-3511,New,-,"Rolinda Harsany, Dds, Inc",Rolinda Harsany - (owner / Dentist),09/14/2020,09/14/2020,Org
https://npidb.org/organizations/ambulatory_health_care/dental_261qd0000x/1811164197.aspx,Rolling Hills Family Dental Lbn Lenny Dayrit Dds Inc,-,"26640 Western Ave Ste M Harbor City, Ca 90710-3639",City,CA,310-325-8111,New,-,Lenny Dayrit Dds Inc,Lenny Dayrit - (president),05/15/2008,05/15/2008,Org
https://npidb.org/organizations/ambulatory_health_care/dental_261qd0000x/1205476371.aspx,"Ron Wilson, D.d.s. Inc.",-,"8 Governors Ln Chico, Ca 95926-1990",Chico,CA,530-877-7661,New,-,"Ron Wilson, D.d.s. Inc.",William Wilson - (president),01/07/2020,01/07/2020,Org
https://npidb.org/organizations/ambulatory_health_care/dental_261qd0000x/1447879507.aspx,Ronald Cruz Abaro Dental Corporation,-,"2360 S Azusa Ave Ste B West Covina, Ca 91792-1540",Covina,CA,626-839-5010,New,-,Ronald Cruz Abaro Dental Corporation,Faviola Silva - (manager),04/09/2020,04/09/2020,Org
https://npidb.org/organizations/ambulatory_health_care/dental_261qd0000x/1982214235.aspx,"Ronald Kim, Dds,inc",-,"7301 Sepulveda Blvd Ste 4 Van Nuys, Ca 91405-1782",Nuys,CA,818-997-0315,New,-,"Ronald Kim, Dds,inc",Ronald Kim - (ceo),08/03/2020,08/03/2020,Org
https://npidb.org/organizations/ambulatory_health_care/federally-qualified-health-center-fqhc_261qf0400x/1205915501.aspx,Ronald Mcdonald Dental Mobile Unit Lbn County Of Santa Clara,"A Federally Qualified Health Center (FQHC) is a community-based organization that provides comprehensive primary care and preventive care, including health, oral, and mental health/substance abuse services to persons of all ages, regardless of their ability to pay or health insurance status.","500 Tully Rd Ronald Mcdonald Dental Mobile Unit San Jose, Ca 95111-1917",Jose,CA,408-885-5000,Govt,-,County Of Santa Clara,Alfonso Banuelos - (chief Medical Officer),11/06/2006,08/22/2020,Org
https://npidb.org/organizations/ambulatory_health_care/dental_261qd0000x/1174538524.aspx,Ronaldo R Saldana Dds Inc,-,"665 H St Ste E Chula Vista, Ca 91910-4211",Vista,CA,619-422-7252,New,-,Ronaldo R Saldana Dds Inc,Ronaldo Saldana - (dentist),07/31/2006,02/17/2015,Org
https://npidb.org/organizations/ambulatory_health_care/dental_261qd0000x/1982064382.aspx,Rootvision Endo,-,"3663 Torrance Blvd Ste 3 Torrance, Ca 90503-4817",Torrance,CA,310-791-0666,New,-,Rootvision Endo,Mark Nugent - (owner),02/26/2016,02/26/2016,Org
https://npidb.org/organizations/ambulatory_health_care/dental_261qd0000x/1811181951.aspx,Rose M. Feliciano Dmd Inc,-,"2577 N 1st St San Jose, Ca 95131-1003",Jose,CA,140-843-3555,New,-,Rose M. Feliciano Dmd Inc,Rose Feliciano - (dentist),08/31/2007,07/30/2008,Org
https://npidb.org/organizations/ambulatory_health_care/dental_261qd0000x/1013117993.aspx,Rosemarie Cristina P. Reyes Dds Inc.,-,"12602 Amargosa Rd Ste. D Victorville, Ca 92392-7640",Victorville,CA,760-243-7701,New,-,Rosemarie Cristina P. Reyes Dds Inc.,Rosemarie Cristina Reyes - (ceo),07/19/2007,07/19/2007,Org
https://npidb.org/organizations/ambulatory_health_care/dental_261qd0000x/1104839158.aspx,Rosenblatt & Firtel Dds Inc,-,"3222 Governor Dr San Diego, Ca 92122",Diego,CA,858-453-8520,New,-,Rosenblatt & Firtel Dds Inc,Ronald Rosenblatt - (president),08/14/2006,08/22/2020,Org
https://npidb.org/organizations/ambulatory_health_care/dental_261qd0000x/1639599129.aspx,Roseville Dental Center Lbn Henry Vong Prof Dental Corp,-,"1771 Pleasant Grove Blvd Ste 180 Roseville, Ca 95747-8720",Roseville,CA,916-772-3847,New,-,Henry Vong Prof Dental Corp,Henry Vong - (president),04/23/2014,04/23/2014,Org
https://npidb.org/organizations/ambulatory_health_care/dental_261qd0000x/1033401922.aspx,Rosewood Dental Care Lbn Leong & Owyang Dental Corporation,-,"4233 Rosewood Dr Ste 11 Pleasanton, Ca 94588-2956",Pleasanton,CA,925-251-9494,New,-,Leong & Owyang Dental Corporation,Oson Leong - (president/owner),05/10/2011,05/10/2011,Org
https://npidb.org/organizations/ambulatory_health_care/dental_261qd0000x/1124363643.aspx,"Rossanne M. Sosa, Dds, Inc",-,"7830 Clairemont Mesa Blvd Ste 208 San Diego, Ca 92111",Diego,CA,858-496-9018,New,-,"Rossanne M. Sosa, Dds, Inc",Rossanne Sosa - (ceo),12/10/2012,05/18/2018,Org
https://npidb.org/organizations/ambulatory_health_care/dental_261qd0000x/1356841639.aspx,"Roxana Shahnavaz Dds Inc,",-,"1010 Cass St Ste D4 Monterey, Ca 93940-4515",Monterey,CA,415-987-3527,New,-,"Roxana Shahnavaz Dds Inc,",Roxana Shahnavaz - (dentist),02/13/2018,02/13/2018,Org
https://npidb.org/organizations/ambulatory_health_care/dental_261qd0000x/1396866000.aspx,"Roya Mirkhan, Dmd, Msd, Inc.",-,"12395 El Camino Real Suite #314 San Diego, Ca 92130-3082",Diego,CA,858-337-6264,New,-,"Roya Mirkhan, Dmd, Msd, Inc.",Roya Mirkhan - (president),04/02/2007,10/22/2010,Org
https://npidb.org/organizations/ambulatory_health_care/dental_261qd0000x/1225336951.aspx,Royal Dental Inc.,-,"6819 Sepulveda Blvd Ste 104 Van Nuys, Ca 91405-4440",Nuys,CA,818-781-7020,New,-,Royal Dental Inc.,Paul Babakhanof - (doctor/ President),03/03/2011,03/03/2011,Org
https://npidb.org/organizations/ambulatory_health_care/dental_261qd0000x/1912468257.aspx,Royce Young Dds Lbn Royce J Young Dds Inc.,-,"178 S Victoria Ave Ste B Ventura, Ca 93003-4368",Ventura,CA,805-642-8165,New,-,Royce J Young Dds Inc.,Royce Young - (ceo),03/28/2019,06/11/2019,Org
https://npidb.org/organizations/ambulatory_health_care/dental_261qd0000x/1205030582.aspx,Rozenovich-yang Partnership,-,"4920 Barranca Pkwy Suite C Irvine, Ca 92604-4672",Irvine,CA,949-857-1366,New,-,Rozenovich-yang Partnership,Della Fahim - (manager),06/12/2007,06/13/2008,Org
https://npidb.org/organizations/ambulatory_health_care/dental_261qd0000x/1598004806.aspx,"Rubi Montejano Dds, Inc",-,"8728 Imperial Hwy Downey, Ca 90242-3906",Downey,CA,562-862-9199,New,-,"Rubi Montejano Dds, Inc",Rubi Montejano - (owner/president),02/06/2013,02/06/2013,Org
https://npidb.org/organizations/ambulatory_health_care/dental_261qd0000x/1669880753.aspx,Rubidoux Dental Lbn County Of Riverside,-,"5256 Mission Blvd Riverside, Ca 92509-4624",Riverside,CA,951-955-0840,Govt,-,County Of Riverside,Terri Wilson-torres - (patient Accounts Manager),08/01/2014,08/01/2014,Org
https://npidb.org/organizations/agencies/public-health-or-welfare_251k00000x/1356455299.aspx,Rubidoux Family Care Center Lbn County Of Riverside,-,"5256 Mission Blvd Riverside, Ca 92509-4611",Riverside,CA,951-955-0840,Govt,-,County Of Riverside,Koen Brown - (deputy Director Ii),08/18/2006,06/11/2009,Org
https://npidb.org/organizations/ambulatory_health_care/dental_261qd0000x/1730432105.aspx,Rubtsov Dds Inc,-,"19301 Saticoy St Ste D Reseda, Ca 91335-2358",Reseda,CA,818-772-4222,New,-,Rubtsov Dds Inc,Olga Rubtsova - (secretary),10/22/2012,10/22/2012,Org
https://npidb.org/organizations/ambulatory_health_care/dental_261qd0000x/1891945317.aspx,"Rubtsov D.d.s., Inc.",-,"12450 Burbank Blvd North Hollywood, Ca 91607-1637",Hollywood,CA,818-763-0777,New,-,"Rubtsov D.d.s., Inc.",Valeriy Rubtsov - (president),09/19/2008,02/27/2009,Org
https://npidb.org/organizations/ambulatory_health_care/dental_261qd0000x/1730694910.aspx,Ruixiang Li Qin Dmd Inc,-,"933 Jackson St Oakland, Ca 94607-4809",Oakland,CA,510-839-1986,New,-,Ruixiang Li Qin Dmd Inc,Ruixiang Qin - (president),12/09/2017,06/16/2018,Org
https://npidb.org/organizations/ambulatory_health_care/dental_261qd0000x/1366981714.aspx,Rupal Javia Dds A Professional Dental Corporation,-,"4685 Lakeview Canyon Rd Westlake Village, Ca 91361-4028",Village,CA,818-879-7480,New,-,Rupal Javia Dds A Professional Dental Corporation,Rupal Javia - (owner Dentist),02/17/2017,02/17/2017,Org
https://npidb.org/organizations/ambulatory_health_care/dental_261qd0000x/1912544768.aspx,Russell W. Cannon Dds Apc,-,"14150 Culver Dr Ste 200 Irvine, Ca 92604-0322",Irvine,CA,949-552-7874,New,-,Russell W. Cannon Dds Apc,Russell Cannon - (president/owner),11/27/2019,11/27/2019,Org
https://npidb.org/organizations/ambulatory_health_care/dental_261qd0000x/1033241260.aspx,Ruth B Garzon Dental Practice Inc,-,"509 Five Cities Dr Pismo Beach, Ca 93449",Beach,CA,805-773-2131,New,-,Ruth B Garzon Dental Practice Inc,Ruth Garzon - (owner Dentist),03/12/2007,08/22/2020,Org
https://npidb.org/organizations/ambulatory_health_care/dental_261qd0000x/1629128145.aspx,"Ruth Veloso Dds.,inc.",-,"4570 W El Segundo Blvd Hawthorne, Ca 90250-4318",Hawthorne,CA,310-973-1927,New,-,"Ruth Veloso Dds.,inc.",Ruth Veloso - (president),01/10/2007,08/22/2020,Org
https://npidb.org/organizations/ambulatory_health_care/dental_261qd0000x/1518479757.aspx,Rwigema Dental Corporation,-,"3025 E Avenue S Ste A14 Palmdale, Ca 93550-2472",Palmdale,CA,661-265-7694,New,-,Rwigema Dental Corporation,Jean-pierre Rwigema - (provider/owner),10/27/2017,10/27/2017,Org
https://npidb.org/organizations/ambulatory_health_care/dental_261qd0000x/1548891427.aspx,Ryan B Baker Dmd A Professional Dental Corporation,-,"27180 Newport Rd Ste 3 Menifee, Ca 92584-7389",Menifee,CA,951-672-1666,New,-,Ryan B Baker Dmd A Professional Dental Corporation,Ryan Baker - (ownder),01/30/2020,01/30/2020,Org
https://npidb.org/organizations/ambulatory_health_care/dental_261qd0000x/1447722244.aspx,"Ryan Kay, Dmd, Inc.",-,"285 N El Camino Real Ste 210 Encinitas, Ca 92024-5385",Encinitas,CA,760-753-3533,New,-,"Ryan Kay, Dmd, Inc.",Ryan Kay - (owner Dentist),12/19/2018,12/19/2018,Org
https://npidb.org/organizations/ambulatory_health_care/dental_261qd0000x/1992327431.aspx,"Ryann Michelle Christensen, Dds, Ms, Pc",-,"1642 E Herndon Ave Ste 105 Fresno, Ca 93720-3377",Fresno,CA,559-261-2055,New,-,"Ryann Michelle Christensen, Dds, Ms, Pc",Ryann Christensen - (president/ Orthodontist),05/07/2020,05/07/2020,Org
https://npidb.org/organizations/ambulatory_health_care/dental_261qd0000x/1578863395.aspx,"S. Ghazarian Dds., Inc.",-,"433 N Montebello Blvd Montebello, Ca 90640-4222",Montebello,CA,323-722-2922,New,-,"S. Ghazarian Dds., Inc.",Shahen Ghazarian - (president/dentist),10/26/2010,10/26/2010,Org
https://npidb.org/organizations/ambulatory_health_care/dental_261qd0000x/1437630340.aspx,S Kutlay Dds Corp Lbn S Kutlay Dds Corp,-,"22800 Lyons Ave Ste 200 Santa Clarita, Ca 91321-2898",Clarita,CA,661-254-1884,New,-,S Kutlay Dds Corp,Sean Kutlay - (president),08/28/2018,08/28/2018,Org
https://npidb.org/organizations/ambulatory_health_care/dental_261qd0000x/1033735527.aspx,"S Nguyen Dds, Inc",-,"35149 Newark Blvd Ste A Newark, Ca 94560-1209",Newark,CA,510-795-9669,New,-,"S Nguyen Dds, Inc",Scott Nguyen - (president),06/19/2020,06/19/2020,Org
https://npidb.org/organizations/ambulatory_health_care/dental_261qd0000x/1235607425.aspx,S. Shaun Daneshgar Dmd Inc,-,"2771 E Florence Ave Ste E Huntington Park, Ca 90255-5750",Park,CA,310-701-0770,New,-,S. Shaun Daneshgar Dmd Inc,Michael Daneshgar - (office Manager),11/06/2018,06/13/2019,Org
https://npidb.org/organizations/ambulatory_health_care/dental_261qd0000x/1326505397.aspx,S. Soleimanian Dds Inc,-,"1620 Westwood Blvd Los Angeles, Ca 90024-5604",Angeles,CA,310-475-5598,New,-,S. Soleimanian Dds Inc,Fay Solomon - (coordinator),02/26/2019,02/26/2019,Org
https://npidb.org/organizations/ambulatory_health_care/dental_261qd0000x/1306311972.aspx,S. Yashari Dental Corp.,-,"1222 Colusa Ave Ste H Yuba City, Ca 95991-3656",City,CA,347-901-2685,New,-,S. Yashari Dental Corp.,Sepand Ghanouni - (owner),10/10/2018,10/10/2018,Org
https://npidb.org/organizations/ambulatory_health_care/federally-qualified-health-center-fqhc_261qf0400x/1164045522.aspx,Sac Health System,"A Federally Qualified Health Center (FQHC) is a community-based organization that provides comprehensive primary care and preventive care, including health, oral, and mental health/substance abuse services to persons of all ages, regardless of their ability to pay or health insurance status.","28078 Baxter Rd Ste 540 Murrieta, Ca 92563-1405",Murrieta,CA,909-382-7100,New,-,Sac Health System,Tasha Amick - (director Of Billing),05/20/2020,05/20/2020,Org
https://npidb.org/organizations/ambulatory_health_care/federally-qualified-health-center-fqhc_261qf0400x/1386266112.aspx,Sac Health System,"A Federally Qualified Health Center (FQHC) is a community-based organization that provides comprehensive primary care and preventive care, including health, oral, and mental health/substance abuse services to persons of all ages, regardless of their ability to pay or health insurance status.","815 S Willow Ave Rialto, Ca 92376-6934",Rialto,CA,909-382-7100,New,-,Sac Health System,Tasha Amick - (director Of Billing),05/14/2020,05/14/2020,Org
https://npidb.org/organizations/ambulatory_health_care/community-health_261qc1500x/1831624493.aspx,Sac Health System,-,"82934 Civic Center Dr Indio, Ca 92201-4308",Indio,CA,909-382-7100,New,-,Sac Health System,Tasha Amick - (director Of Billing),04/20/2017,03/10/2020,Org
https://npidb.org/organizations/ambulatory_health_care/federally-qualified-health-center-fqhc_261qf0400x/1437784410.aspx,Sac Mobile Unit #1 Lbn Sac Health System,"A Federally Qualified Health Center (FQHC) is a community-based organization that provides comprehensive primary care and preventive care, including health, oral, and mental health/substance abuse services to persons of all ages, regardless of their ability to pay or health insurance status.","250 S G St San Bernardino, Ca 92410-3320",Bernardino,CA,909-382-7180,New,-,Sac Health System,Tasha Amick - (director Of Billing),03/10/2020,03/10/2020,Org
https://npidb.org/organizations/ambulatory_health_care/federally-qualified-health-center-fqhc_261qf0400x/1528693504.aspx,Sac Mobile Unit #2 Lbn Sac Health System,"A Federally Qualified Health Center (FQHC) is a community-based organization that provides comprehensive primary care and preventive care, including health, oral, and mental health/substance abuse services to persons of all ages, regardless of their ability to pay or health insurance status.","250 S G St San Bernardino, Ca 92410-3320",Bernardino,CA,909-382-7180,New,-,Sac Health System,Tasha Amick - (director Of Billing),03/10/2020,03/10/2020,Org
https://npidb.org/organizations/ambulatory_health_care/federally-qualified-health-center-fqhc_261qf0400x/1013935915.aspx,Sac Norton Community Lbn Sac Health System,"A Federally Qualified Health Center (FQHC) is a community-based organization that provides comprehensive primary care and preventive care, including health, oral, and mental health/substance abuse services to persons of all ages, regardless of their ability to pay or health insurance status.","1454 E 2nd St San Bernardino, Ca 92408-0118",Bernardino,CA,909-382-7100,Govt,-,Sac Health System,Tasha Amick - (dir. Of Billing),07/18/2006,03/10/2020,Org
https://npidb.org/organizations/ambulatory_health_care/federally-qualified-health-center-fqhc_261qf0400x/1801270137.aspx,Sac San Bernardino Campus Lbn Sac Health System,"A Federally Qualified Health Center (FQHC) is a community-based organization that provides comprehensive primary care and preventive care, including health, oral, and mental health/substance abuse services to persons of all ages, regardless of their ability to pay or health insurance status.","250 South G Street San Bernardino, Ca 92410",Bernardino,CA,909-382-7100,New,-,Sac Health System,Tasha Amick - (dir Of Billing),07/16/2015,03/10/2020,Org
https://npidb.org/organizations/ambulatory_health_care/federally-qualified-health-center-fqhc_261qf0400x/1982164877.aspx,Sac Sbusd Resource Center Lbn Sac Health System,"A Federally Qualified Health Center (FQHC) is a community-based organization that provides comprehensive primary care and preventive care, including health, oral, and mental health/substance abuse services to persons of all ages, regardless of their ability to pay or health insurance status.","781 W 2nd St Ste A San Bernardino, Ca 92410-3279",Bernardino,CA,909-382-7100,New,-,Sac Health System,Tasha Amick - (director Of Billing),03/25/2019,03/10/2020,Org
https://npidb.org/organizations/ambulatory_health_care/dental_261qd0000x/1659757698.aspx,Sachi A Fujita Dds A Professional Corporation,-,"23545 Crenshaw Blvd Suite 105 Torrance, Ca 90505-5218",Torrance,CA,310-323-2320,New,-,Sachi A Fujita Dds A Professional Corporation,Liz Quijada - (office Manager),07/31/2015,05/28/2019,Org
https://npidb.org/organizations/ambulatory_health_care/federally-qualified-health-center-fqhc_261qf0400x/1144600248.aspx,"Sacramento Community Clinic Lbn Health And Life Organization, Inc","A Federally Qualified Health Center (FQHC) is a community-based organization that provides comprehensive primary care and preventive care, including health, oral, and mental health/substance abuse services to persons of all ages, regardless of their ability to pay or health insurance status.","3030 Explorer Dr Sacramento, Ca 95827-2728",Sacramento,CA,916-254-5700,Govt,-,"Health And Life Organization, Inc",Jerry Bliatout - (administrator),06/03/2015,06/25/2015,Org
https://npidb.org/organizations/ambulatory_health_care/dental_261qd0000x/1356841951.aspx,Sacramento Spa Dentistry Lbn Maryam Torabian Dds Inc,-,"2441 Garfield Ave Carmichael, Ca 95608-9560",Carmichael,CA,916-213-7845,New,-,Maryam Torabian Dds Inc,Maryam Torabian - (president),02/20/2018,02/20/2018,Org
https://npidb.org/organizations/ambulatory_health_care/dental_261qd0000x/1972777829.aspx,Sae Rom Kim.dds.inc,-,"2300 N Imperial Ave Calexico, Ca 92231-3209",Calexico,CA,760-357-1632,New,-,Sae Rom Kim.dds.inc,Sae Rom Kim - (president),04/22/2008,04/22/2008,Org
https://npidb.org/organizations/ambulatory_health_care/dental_261qd0000x/1376707661.aspx,"Safaeddin Jahanbani D.d.s., Inc.",-,"113 Waterworks Way Ste 130 Irvine, Ca 92618-3168",Irvine,CA,949-836-7831,New,-,"Safaeddin Jahanbani D.d.s., Inc.",Safaeddin Jahanbani - (president),07/15/2008,07/15/2008,Org
https://npidb.org/organizations/dental_health/general-practice_1223g0001x/1356495865.aspx,"Sahabi D.d.s., Dental Corporation","A general dentist is the primary dental care provider for patients of all ages. The general dentist is responsible for the diagnosis, treatment, management and overall coordination of services related to patients' oral health needs.","4701 Eagle Rock Blvd Los Angeles, Ca 90041-2711",Angeles,CA,323-255-5572,New,-,"Sahabi D.d.s., Dental Corporation",Kamran Sahabi - (president-ceo),01/22/2007,08/04/2020,Org
https://npidb.org/organizations/ambulatory_health_care/dental_261qd0000x/1275006959.aspx,Sahar Yaftaly Dmd Inc,-,"2045 Royal Ave Ste 109 Simi Valley, Ca 93065-4666",Valley,CA,805-522-9242,New,-,Sahar Yaftaly Dmd Inc,Sahar Yaftaly - (owner),01/06/2019,01/06/2019,Org
https://npidb.org/organizations/ambulatory_health_care/dental_261qd0000x/1639417306.aspx,Saint Mina Family Dental Lbn Fawzy Tadros Dds.inc,-,"12601 San Fernando Rd Ste H Sylmar, Ca 91342-7733",Sylmar,CA,818-364-1991,New,-,Fawzy Tadros Dds.inc,Fawzy Tadros - (owner),01/30/2013,01/30/2013,Org
https://npidb.org/organizations/ambulatory_health_care/dental_261qd0000x/1255859237.aspx,Salama Dental Inc,-,"31093 Riverside Dr Lake Elsinore, Ca 92530-7876",Elsinore,CA,951-457-7330,New,-,Salama Dental Inc,Wasfi Salama - (owner),08/30/2017,08/30/2017,Org
https://npidb.org/organizations/ambulatory_health_care/ambulatory-surgical_261qa1903x/1588875967.aspx,"Salida Surgery Center Lbn Pankaj K. Patel, Dmd & Shailesh K. Patel, Dds A Professional Corp",-,"5712 Pirrone Rd Salida, Ca 95368-9313",Salida,CA,209-543-9299,New,-,"Pankaj K. Patel, Dmd & Shailesh K. Patel, Dds A Professional Corp",Laura Young - (administrator),05/25/2007,02/25/2020,Org
https://npidb.org/organizations/ambulatory_health_care/dental_261qd0000x/1104309798.aspx,Salih M Mayalidag Dental Corp,-,"6073 N Fresno St Ste 103 Fresno, Ca 93710-8614",Fresno,CA,559-432-9988,New,-,Salih M Mayalidag Dental Corp,Salih Mayalidag - (owner),09/11/2018,09/11/2018,Org
https://npidb.org/organizations/ambulatory_health_care/dental_261qd0000x/1790169878.aspx,Salina Sanchez Asidera Dds Inc.,-,"7214 Canoga Ave Canoga Park, Ca 91303-1627",Park,CA,818-715-9374,New,-,Salina Sanchez Asidera Dds Inc.,Salina Asidera - (president),07/17/2015,07/17/2015,Org
https://npidb.org/organizations/ambulatory_health_care/dental_261qd0000x/1669656625.aspx,Salman Dental,-,"927 Armory Rd Barstow, Ca 92311-5460",Barstow,CA,760-252-4488,New,-,Salman Dental,Asad Salman - (owner),12/26/2007,12/26/2007,Org
https://npidb.org/organizations/ambulatory_health_care/dental_261qd0000x/1659579142.aspx,Sam A. Lavi Dmd Inc,-,"4341 Laurel Canyon Blvd Studio City, Ca 91604-1710",City,CA,818-980-8472,New,-,Sam A. Lavi Dmd Inc,Shahram Lavi - (president),07/05/2007,08/22/2020,Org
https://npidb.org/organizations/ambulatory_health_care/dental_261qd0000x/1013494087.aspx,Saman Sajid Dds Dental Corporation,-,"2725 El Camino Real Ste 109 Santa Clara, Ca 95051-3000",Clara,CA,408-241-4111,New,-,Saman Sajid Dds Dental Corporation,Saman Sajid - (president),07/23/2018,07/23/2018,Org
https://npidb.org/organizations/ambulatory_health_care/dental_261qd0000x/1174160584.aspx,Samaneh Daftarian Dental Corp,-,"625 Menlo Ave Menlo Park, Ca 94025-4747",Park,CA,650-324-9272,New,-,Samaneh Daftarian Dental Corp,Samaneh Daftarian - (president),12/04/2019,12/04/2019,Org
https://npidb.org/organizations/ambulatory_health_care/dental_261qd0000x/1215172283.aspx,Samaritan Dental Care,-,"2516 Samaritan Dr Suite I San Jose, Ca 95124-4108",Jose,CA,408-358-7645,New,-,Samaritan Dental Care,Hai Vu - (dentist),12/04/2008,12/04/2008,Org
https://npidb.org/organizations/ambulatory_health_care/dental_261qd0000x/1356854723.aspx,Samia Ali Dds Lbn Ali Samia Dds Inc,-,"8540 S Sepulveda Blvd Ste 1000 Los Angeles, Ca 90045",Angeles,CA,310-649-2430,New,-,Ali Samia Dds Inc,Kathy Albert - (office Manager),11/08/2017,06/16/2018,Org
https://npidb.org/organizations/ambulatory_health_care/dental_261qd0000x/1104967223.aspx,"Samir B Halaka Dds, Inc",-,"6767 W Sunset Blvd Suite 25 Los Angeles, Ca 90028-7177",Angeles,CA,323-469-8816,New,-,"Samir B Halaka Dds, Inc",Samir Halaka - (president),02/09/2007,07/18/2008,Org
https://npidb.org/organizations/ambulatory_health_care/dental_261qd0000x/1669003448.aspx,"Samir Rizvanbegovic,dds,inc.",-,"44421 Town Center Way Ste C Palm Desert, Ca 92260-2705",Desert,CA,760-776-1646,New,-,"Samir Rizvanbegovic,dds,inc.",Samir Rizvanbegovic - (president),01/30/2020,01/30/2020,Org
https://npidb.org/organizations/ambulatory_health_care/dental_261qd0000x/1427384007.aspx,Samuel C. Rombaoa Dds Inc,-,"125 E Barstow Ave Suite 122 Fresno, Ca 93710-5020",Fresno,CA,559-227-5309,New,-,Samuel C. Rombaoa Dds Inc,Samuel Rombaoa - (owner/president),11/02/2009,11/02/2009,Org
