https://npidb.org/organizations/dental_health/dentist_122300000x/1932540614.aspx,"Kamran Sahabi Dds Inc., Tustin","A dentist is a person qualified by a doctorate in dental surgery (D.D.S.) or dental medicine (D.M.D.), licensed by the state to practice dentistry, and practicing within the scope of that license.  There is no difference between the two degrees: dentists who have a DMD or DDS have the same education.  Universities have the prerogative to determine what degree is awarded.  Both degrees use the same curriculum requirements set by the American Dental Association's Commission on Dental Accreditation.  Generally, three or more years of undergraduate education plus four years of dental school is required to graduate and become a general dentist.  State licensing boards accept either degree as equivalent, and both degrees allow licensed individuals to practice the same scope of general dentistry.  Additional post-graduate training is required to become a dental specialist.","13011 Newport Ave Suite 205 Tustin, Ca 92780-3524",Tustin,CA,714-386-3663,New,-,"Kamran Sahabi Dds Inc., Tustin",Kamran Sahabi - (president),07/10/2013,08/04/2020,Org
https://npidb.org/organizations/ambulatory_health_care/dental_261qd0000x/1356465017.aspx,Kanwal J.s. Virk Lbn Dr Virks Dental Practice,-,"221 W Anaheim St Wilmington, Ca 90744",Wilmington,CA,310-233-7777,New,-,Dr Virks Dental Practice,Kanwaljit Virk - (owner),03/19/2007,08/22/2020,Org
https://npidb.org/organizations/ambulatory_health_care/dental_261qd0000x/1104121219.aspx,Karagyozyan Dds Inc.,-,"310 N Pomona Ave Fullerton, Ca 92832-1928",Fullerton,CA,714-992-5490,New,-,Karagyozyan Dds Inc.,Yerevan Karagyozyan - (owner),01/20/2011,01/20/2011,Org
https://npidb.org/organizations/ambulatory_health_care/dental_261qd0000x/1003219676.aspx,Karapetian Dental Corporation,-,"457 W Colorado St Ste 201 Glendale, Ca 91204-4844",Glendale,CA,818-543-0707,New,-,Karapetian Dental Corporation,Oganes Karapetian - (president),09/26/2014,09/26/2014,Org
https://npidb.org/organizations/ambulatory_health_care/dental_261qd0000x/1164562799.aspx,"Karen H. Ho, D.d.s., Inc.",-,"1234 S Garfield Ave Ste. 101 Alhambra, Ca 91801-5065",Alhambra,CA,626-576-8100,New,-,"Karen H. Ho, D.d.s., Inc.",Karen Ho - (ceo),02/06/2007,08/22/2020,Org
https://npidb.org/organizations/ambulatory_health_care/dental_261qd0000x/1720311418.aspx,"Karen M Depaoli, Dds Inc",-,"1321 N Harbor Blvd Suite 100 Fullerton, Ca 92835-4124",Fullerton,CA,714-441-2372,New,-,"Karen M Depaoli, Dds Inc",Karen Depaoli - (president),09/11/2009,09/11/2009,Org
https://npidb.org/organizations/ambulatory_health_care/dental_261qd0000x/1528628195.aspx,Karen Trinh Dds Inc.,-,"98 Mariposa Ave Watsonville, Ca 95076-2660",Watsonville,CA,831-724-1003,New,-,Karen Trinh Dds Inc.,Karen Ngoc-diem Trinh - (president),06/17/2019,06/17/2019,Org
https://npidb.org/organizations/ambulatory_health_care/dental_261qd0000x/1770113029.aspx,Karineh Avaness Dmd Inc,-,"4955 Van Nuys Blvd Ste 202 Sherman Oaks, Ca 91403-1820",Oaks,CA,818-471-5231,New,-,Karineh Avaness Dmd Inc,Karineh Avaness - (dentist/owner),01/24/2020,01/24/2020,Org
https://npidb.org/organizations/ambulatory_health_care/dental_261qd0000x/1083868426.aspx,"Karla L Guinn, Dds, Inc Lbn Karla Thompson, Dds, Inc",-,"18981 Ventura Blvd Ste 200 Tarzana, Ca 91356-3256",Tarzana,CA,818-654-7100,New,-,"Karla Thompson, Dds, Inc",Karla Thompson - (president/owner),11/12/2008,11/12/2008,Org
https://npidb.org/organizations/ambulatory_health_care/dental_261qd0000x/1699906586.aspx,Katsuko Matsui Inc. A Professional Dental Cooperation,-,"5631 Lincoln Ave Cypress, Ca 90630-3156",Cypress,CA,714-995-2040,New,-,Katsuko Matsui Inc. A Professional Dental Cooperation,Katsuko Matsui - (president),07/27/2009,08/10/2009,Org
https://npidb.org/organizations/ambulatory_health_care/dental_261qd0000x/1174990287.aspx,Kayla Koo Dds Inc,-,"5680 Whittier Blvd Commerce, Ca 90022-4106",Commerce,CA,323-597-0000,New,-,Kayla Koo Dds Inc,Kayla Koo - (owner),08/24/2015,12/06/2015,Org
https://npidb.org/organizations/ambulatory_health_care/dental_261qd0000x/1184195349.aspx,"Kazem Hosny, Dds Apc",-,"126 W B St Ontario, Ca 91762-3503",Ontario,CA,909-984-4746,New,-,"Kazem Hosny, Dds Apc",Kazem Hosny - (dentist),12/16/2018,08/29/2019,Org
https://npidb.org/organizations/ambulatory_health_care/dental_261qd0000x/1134510431.aspx,"Keith W. Cowhey, Dds, Inc",-,"400 5th St Seal Beach, Ca 90740-5967",Beach,CA,562-431-2929,New,-,"Keith W. Cowhey, Dds, Inc",Keith Cowhey - (president),02/09/2015,02/09/2015,Org
https://npidb.org/organizations/ambulatory_health_care/dental_261qd0000x/1508126731.aspx,Kelli Junker Dds Inc,-,"400 Newport Center Drive #708 Newport Beach, Ca 92660-8604",Beach,CA,949-640-2970,New,-,Kelli Junker Dds Inc,Kelli Junker - (owner),05/22/2012,05/22/2012,Org
https://npidb.org/organizations/ambulatory_health_care/dental_261qd0000x/1093931396.aspx,"Kenneth R, Marti Dds Inc.",-,"6049 Douglas Blvd Suite 9 Granite Bay, Ca 95746-6284",Bay,CA,916-791-4133,New,-,"Kenneth R, Marti Dds Inc.",Kenneth Marti - (owner),04/17/2007,08/22/2020,Org
https://npidb.org/organizations/ambulatory_health_care/dental_261qd0000x/1598943391.aspx,"Kenneth V. Hoang, Dmd, Inc",-,"6950 Santa Teresa Blvd Ste C San Jose, Ca 95119-1300",Jose,CA,408-629-1212,New,-,"Kenneth V. Hoang, Dmd, Inc",Kenneth Hoang - (owner),02/04/2008,02/04/2008,Org
https://npidb.org/organizations/ambulatory_health_care/dental_261qd0000x/1346451549.aspx,"Kenny Y. Wu Dds, Inc.",-,"20395 Pacifica Dr Ste 111 Cupertino, Ca 95014-3016",Cupertino,CA,626-922-6727,New,-,"Kenny Y. Wu Dds, Inc.",Kenny Wu - (ceo),05/28/2007,08/22/2020,Org
https://npidb.org/organizations/ambulatory_health_care/dental_261qd0000x/1972136877.aspx,Kens Dental Partnership,-,"1928 Tyler Ave El Monte, Ca 91733-3609",Monte,CA,626-443-7922,New,-,Kens Dental Partnership,Sanjay Lala - (partner),02/19/2020,02/28/2020,Org
https://npidb.org/organizations/ambulatory_health_care/dental_261qd0000x/1932315298.aspx,Keon-jung Kim Dental Corporation,-,"2492 Walnut Ave Ste 200 Tustin, Ca 92780-6960",Tustin,CA,949-679-6000,New,-,Keon-jung Kim Dental Corporation,Keon-jung Kim - (owner),05/15/2007,03/17/2018,Org
https://npidb.org/organizations/ambulatory_health_care/dental_261qd0000x/1114132107.aspx,Keon-jung Kim Professional Dental Corporation,-,"3257 Camino De Los Coches #303 Carlsbad, Ca 92009-8966",Carlsbad,CA,760-479-9876,New,-,Keon-jung Kim Professional Dental Corporation,Keon-jung Kim - (owner),05/11/2007,08/23/2007,Org
https://npidb.org/organizations/ambulatory_health_care/dental_261qd0000x/1730737305.aspx,"Keri Silva Dds, Inc.",-,"6576 High Knoll Rd San Diego, Ca 92111-5427",Diego,CA,818-439-4834,New,-,"Keri Silva Dds, Inc.",Keri Silva - (president),08/28/2019,07/10/2020,Org
https://npidb.org/organizations/ambulatory_health_care/dental_261qd0000x/1093998304.aspx,Kessler & Resnick Dental Design,-,"28632 Roadside Dr Ste 270b Agoura Hills, Ca 91301-6064",Hills,CA,818-706-6077,New,-,Kessler & Resnick Dental Design,Darren Kessler - (dentist),12/10/2007,12/10/2007,Org
https://npidb.org/organizations/ambulatory_health_care/dental_261qd0000x/1609048867.aspx,"Kevin E. Lew, Dds, Md, Inc.",-,"321 N Larchmont Blvd Suite 617 Los Angeles, Ca 90004-3025",Angeles,CA,323-465-6451,New,-,"Kevin E. Lew, Dds, Md, Inc.",Kevin Lew - (president),03/27/2008,03/27/2008,Org
https://npidb.org/organizations/ambulatory_health_care/dental_261qd0000x/1568637064.aspx,"Kevin G. Landon, Dds, Inc.",-,"333 El Dorado St Monterey, Ca 93940-4606",Monterey,CA,831-375-4014,New,-,"Kevin G. Landon, Dds, Inc.",Kevin Landon - (dentist),04/25/2008,09/22/2014,Org
https://npidb.org/organizations/ambulatory_health_care/dental_261qd0000x/1255817375.aspx,Kevin J. Coolidge Dds Inc.,-,"500 E Remington Dr Ste 22 Sunnyvale, Ca 94087-2612",Sunnyvale,CA,408-736-4344,New,-,Kevin J. Coolidge Dds Inc.,Kevin Coolidge - (owner),07/11/2018,07/11/2018,Org
https://npidb.org/organizations/ambulatory_health_care/dental_261qd0000x/1295048023.aspx,"Kevin Ju, Dds, Inc.",-,"44439 17th St W Ste 201 201 Lancaster, Ca 93534-2856",Lancaster,CA,661-723-1461,New,-,"Kevin Ju, Dds, Inc.",Kevin Ju - (president),07/21/2010,04/24/2017,Org
https://npidb.org/organizations/ambulatory_health_care/dental_261qd0000x/1508354184.aspx,Kevin Seungjoon Hyun D.d.s. Inc,-,"11899 Del Amo Blvd Cerritos, Ca 90703-7605",Cerritos,CA,562-402-4411,New,-,Kevin Seungjoon Hyun D.d.s. Inc,Kevin Hyun - (president),04/29/2018,08/11/2018,Org
https://npidb.org/organizations/ambulatory_health_care/dental_261qd0000x/1295393445.aspx,"Kevin Thai Le Dds, Inc",-,"18845 Sherman Way Ste J Reseda, Ca 91335-4042",Reseda,CA,818-757-8953,New,-,"Kevin Thai Le Dds, Inc",Kevin Le - (ceo),06/03/2019,06/27/2019,Org
https://npidb.org/organizations/ambulatory_health_care/dental_261qd0000x/1447805890.aspx,Kha D Le Dental Corp.,-,"2121 E Coast Hwy Ste 220 Corona Del Mar, Ca 92625-1934",Mar,CA,949-644-1001,New,-,Kha D Le Dental Corp.,Kha Le - (owner/dentist),08/02/2019,08/02/2019,Org
https://npidb.org/organizations/ambulatory_health_care/dental_261qd0000x/1801437520.aspx,Khajadour Donabedian Dds Inc,-,"2063 E Foothill Blvd Pasadena, Ca 91107-3277",Pasadena,CA,626-449-1919,New,-,Khajadour Donabedian Dds Inc,Khajadour Donabedian - (dentist),10/03/2019,10/03/2019,Org
https://npidb.org/organizations/ambulatory_health_care/dental_261qd0000x/1942496823.aspx,"Khanh D. Le, D.d.s.",-,"7052 Owensmouth Ave Canoga Park, Ca 91303-2005",Park,CA,818-713-8034,New,-,"Khanh D. Le, D.d.s.",Khanh Le - (owner),09/24/2007,09/24/2007,Org
https://npidb.org/organizations/ambulatory_health_care/dental_261qd0000x/1457875809.aspx,Khs Pannu Dds Inc,-,"1950 Douglas Blvd Ste B1 Roseville, Ca 95661-3827",Roseville,CA,(916) 783-7105,New,-,Khs Pannu Dds Inc,Karan Pannu - (owner Ceo),07/27/2017,07/27/2017,Org
https://npidb.org/organizations/ambulatory_health_care/dental_261qd0000x/1205320314.aspx,Kids R Us Dental Lbn Dr A Nguyen Dds Inc,-,"325 Old Newport Blvd Newport Beach, Ca 92663-4155",Beach,CA,714-478-5416,New,-,Dr A Nguyen Dds Inc,Anh Nguyen - (president),06/21/2018,06/21/2018,Org
https://npidb.org/organizations/ambulatory_health_care/dental_261qd0000x/1205476207.aspx,Kids Smile Dental And Orthodontics Lbn Drs Salem And Soliman Dental Corp,-,"1021 S Main St Manteca, Ca 95337-5703",Manteca,CA,209-250-2600,New,-,Drs Salem And Soliman Dental Corp,Ahmed Salem - (owner),01/08/2020,05/15/2020,Org
https://npidb.org/organizations/ambulatory_health_care/dental_261qd0000x/1316170210.aspx,"Kidz Dental Care Lbn Charlotte Roberson Dds., Inc",-,"11239 Tampa Ave Suite 208 Northridge, Ca 91326-1615",Northridge,CA,818-368-6277,New,-,"Charlotte Roberson Dds., Inc",Charlotte Roberson - (president),08/26/2009,08/26/2009,Org
https://npidb.org/organizations/ambulatory_health_care/dental_261qd0000x/1083030092.aspx,Kim And Gandhi Kim Dental Corporation,-,"5881 Pine Ave, Suite B Chino Hills, Ca 91709",Ave,CA,415-608-2837,New,-,Kim And Gandhi Kim Dental Corporation,Jin Kim - (orthodontist),03/14/2014,03/14/2014,Org
https://npidb.org/organizations/dental_health/general-practice_1223g0001x/1588288591.aspx,"Kim & Lee, A Dental Corporation","A general dentist is the primary dental care provider for patients of all ages. The general dentist is responsible for the diagnosis, treatment, management and overall coordination of services related to patients' oral health needs.","11033 Rosecrans Ave Ste D Norwalk, Ca 90650-3663",Norwalk,CA,503-360-8886,New,-,"Kim & Lee, A Dental Corporation",Linda Lee - (ceo),06/04/2020,06/04/2020,Org
https://npidb.org/organizations/ambulatory_health_care/dental_261qd0000x/1396944492.aspx,Kim Luu D.d.s. Inc.,-,"991 Montague Expy Ste 202 Milpitas, Ca 95035-6819",Milpitas,CA,408-263-3090,New,-,Kim Luu D.d.s. Inc.,Kim Luu - (president),07/17/2007,11/26/2012,Org
https://npidb.org/organizations/ambulatory_health_care/dental_261qd0000x/1235286444.aspx,"Kimber L. Sineri, Dds, Inc.",-,"501 W Kern Ave Mcfarland, Ca 93250-1354",Mcfarland,CA,661-792-3028,New,-,"Kimber L. Sineri, Dds, Inc.",Kimber Sineri - (president),01/03/2007,08/22/2020,Org
https://npidb.org/organizations/ambulatory_health_care/dental_261qd0000x/1265850424.aspx,"Kimber Park Family Dental Lbn Shuen Family Dental Group, Inc.",-,"39812 Mission Blvd Ste 109 Fremont, Ca 94539-3088",Fremont,CA,510-661-0788,New,-,"Shuen Family Dental Group, Inc.",Suwen Shuen - (president),04/03/2014,04/03/2014,Org
https://npidb.org/organizations/ambulatory_health_care/dental_261qd0000x/1306317755.aspx,Kimmer E. Young D.d.s. Dental Corporation,-,"2401 W Cleveland Ave Madera, Ca 93637-3608",Madera,CA,559-673-4075,New,-,Kimmer E. Young D.d.s. Dental Corporation,Kimmer Young - (owner),12/11/2018,12/13/2018,Org
https://npidb.org/organizations/ambulatory_health_care/dental_261qd0000x/1558712398.aspx,Kinberly Antrim Dds Dental Corporation,-,"7880 Wren Ave Suite A-113 Gilroy, Ca 95020-4943",Gilroy,CA,408-375-2155,New,-,Kinberly Antrim Dds Dental Corporation,Kinberly Antrim - (president),06/23/2016,06/23/2016,Org
https://npidb.org/organizations/ambulatory_health_care/dental_261qd0000x/1295925261.aspx,"King Dental Practice Lbn Hai Lai, A Professional Dental Corporation",-,"2623 W Lincoln Ave Ste 101 Anaheim, Ca 92801-6310",Anaheim,CA,714-774-2500,New,-,"Hai Lai, A Professional Dental Corporation",Hai Lai - (ceo),07/26/2007,05/30/2019,Org
https://npidb.org/organizations/ambulatory_health_care/dental_261qd0000x/1750886651.aspx,Kirandeep Kaur Dds Inc,-,"90 Copper Cove Dr Ste A Copperopolis, Ca 95228-9373",Copperopolis,CA,646-413-5840,New,-,Kirandeep Kaur Dds Inc,Kirandeep Kaur - (president),03/24/2018,03/24/2018,Org
https://npidb.org/organizations/ambulatory_health_care/dental_261qd0000x/1437457553.aspx,"Kirk Yen, Dds, Inc.",-,"1660 Willow St Suite 5 San Jose, Ca 95125-5101",Jose,CA,408-265-7530,New,-,"Kirk Yen, Dds, Inc.",Kirk Yen - (president),03/14/2011,03/14/2011,Org
https://npidb.org/organizations/ambulatory_health_care/dental_261qd0000x/1801398201.aspx,Kiwon Youn Dds Inc,-,"18250 Colima Rd Ste 201 Rowland Heights, Ca 91748-2618",Heights,CA,626-964-2875,New,-,Kiwon Youn Dds Inc,Kiwon Youn - (owner),03/02/2018,03/02/2018,Org
https://npidb.org/organizations/ambulatory_health_care/dental_261qd0000x/1265625735.aspx,"Kiwoong Lee Dds, Inc.",-,"1521 N Broadway Santa Ana, Ca 92706-3906",Ana,CA,714-972-2801,New,-,"Kiwoong Lee Dds, Inc.",Kiwoong Lee - (chief Officer),08/19/2007,08/19/2007,Org
https://npidb.org/organizations/ambulatory_health_care/dental_261qd0000x/1699092700.aspx,Kmc Dental Group Lbn Soung Hoon Cho Dds. Inc,-,"2700 Alton Pkwy Ste 225 Irvine, Ca 92606-2646",Irvine,CA,949-253-8300,New,-,Soung Hoon Cho Dds. Inc,Soung Cho - (doctor/ Manager),04/28/2010,06/20/2018,Org
https://npidb.org/organizations/ambulatory_health_care/dental_261qd0000x/1346626066.aspx,Koka Dental Corporation,-,"8031 Linda Vista Rd Suite 210 San Diego, Ca 92111-5110",Diego,CA,858-268-5020,New,-,Koka Dental Corporation,Sreenivas Koka - (owner),08/04/2015,08/04/2015,Org
https://npidb.org/organizations/ambulatory_health_care/dental_261qd0000x/1417515008.aspx,Koshki And Naminik Dental Corp,-,"711 W Whittier Blvd Montebello, Ca 90640-4709",Montebello,CA,323-278-0170,New,-,Koshki And Naminik Dental Corp,Moeiz Koshki - (owner),05/30/2019,05/30/2019,Org
https://npidb.org/organizations/ambulatory_health_care/dental_261qd0000x/1215051453.aspx,Kourosh Harandi Dds. Ms. Inc.,-,"1500 Tara Hills Dr Suite 202 Pinole, Ca 94564-2577",Pinole,CA,510-724-3666,New,-,Kourosh Harandi Dds. Ms. Inc.,Kourosh Harandi - (owner),03/16/2007,08/22/2020,Org
https://npidb.org/organizations/ambulatory_health_care/dental_261qd0000x/1679790638.aspx,Kourosh Michael Beral Dds Inc,-,"808 W 58th St Los Angeles, Ca 90037-3632",Angeles,CA,323-541-1600,New,-,Kourosh Michael Beral Dds Inc,Kourosh Beral - (president),04/19/2007,08/22/2016,Org
https://npidb.org/organizations/ambulatory_health_care/dental_261qd0000x/1477030351.aspx,Koushan Azad Dental Corpopration,-,"3870 Broad St Ste 1 San Luis Obispo, Ca 93401-7172",Obispo,CA,630-624-5788,New,-,Koushan Azad Dental Corpopration,Olivia Aguinaga - (business Coordinator),07/24/2018,07/24/2018,Org
https://npidb.org/organizations/ambulatory_health_care/dental_261qd0000x/1285242388.aspx,Koushan Azad Dmd. Inc,-,"238 E Betteravia Rd Ste C Santa Maria, Ca 93454-7889",Maria,CA,805-202-4988,New,-,Koushan Azad Dmd. Inc,Olivia Aguinaga - (business Coordinator),07/15/2020,08/28/2020,Org
https://npidb.org/doctors/ambulatory_health_care/dental_261qd0000x/1760640668.aspx,"Larry A Kozek, Dds Npi #1760640668dental","Profile for Dr LARRY A KOZEK in BEVERLY HILLS, CA.","436 N Roxbury Drive Suite 109 Beverly Hills, Ca 90210",Hills,CA,310-385-1311,New,-,-,"s-Larry A Kozek, Dds Npi #1760640668dental-Active",05/28/2008,05/28/2008,Sole
https://npidb.org/organizations/ambulatory_health_care/dental_261qd0000x/1184882391.aspx,"Krasnodara Gashparova, Dds, Inc",-,"1933 W Valley Blvd Alhambra, Ca 91803-2346",Alhambra,CA,626-289-6131,New,-,"Krasnodara Gashparova, Dds, Inc",Krasnodara Gashparova - (president),05/26/2008,05/26/2008,Org
https://npidb.org/organizations/ambulatory_health_care/dental_261qd0000x/1043640915.aspx,"Kristen Ritzau Dds, Inc.",-,"122 Avenida Cabrillo San Clemente, Ca 92672-4039",Clemente,CA,949-498-4110,New,-,"Kristen Ritzau Dds, Inc.",Kristen Ritzau - (owner),11/13/2013,11/13/2013,Org
https://npidb.org/organizations/ambulatory_health_care/dental_261qd0000x/1821398587.aspx,"Kristina L. Wiley, Dds, Inc.",-,"140 N Jackson St Suite 1 Dixon, Ca 95620-3034",Dixon,CA,707-678-9248,New,-,"Kristina L. Wiley, Dds, Inc.",Kristina Wiley - (ceo/ Owner),10/28/2010,10/28/2010,Org
https://npidb.org/organizations/ambulatory_health_care/dental_261qd0000x/1134693211.aspx,"Kristine Nga Hoang Tran, Dmd, Inc.",-,"8413 Westminster Blvd Westminster, Ca 92683-3308",Westminster,CA,714-891-2831,New,-,"Kristine Nga Hoang Tran, Dmd, Inc.",Kristine Tran - (dentist/president),01/11/2019,01/11/2019,Org
https://npidb.org/organizations/ambulatory_health_care/dental_261qd0000x/1114460557.aspx,Kuwaye Dental Lbn Dennis K Kuwaye Jr Dds Inc,-,"2533 Via Campo Montebello, Ca 90640-1806",Montebello,CA,323-721-7401,New,-,Dennis K Kuwaye Jr Dds Inc,Dennis Kuwaye - (dr),12/01/2016,12/01/2016,Org
https://npidb.org/organizations/ambulatory_health_care/dental_261qd0000x/1427670603.aspx,"Kwang S. Kim Dds, Inc",-,"2135 Cypress Ave Los Angeles, Ca 90065-1212",Angeles,CA,323-223-0731,New,-,"Kwang S. Kim Dds, Inc",Kwang Kim - (owner),05/11/2020,05/11/2020,Org
https://npidb.org/organizations/ambulatory_health_care/dental_261qd0000x/1720454432.aspx,Kwiatkowski And Marschik Prof Dental Corp,-,"880 Cass St Suite#207 Monterey, Ca 93940-2947",Monterey,CA,831-372-4411,New,-,Kwiatkowski And Marschik Prof Dental Corp,Maryanne Marschik - (dr/ Coowner),08/17/2015,08/17/2015,Org
https://npidb.org/organizations/ambulatory_health_care/dental_261qd0000x/1114370079.aspx,"Kwon & Jabbour Dental, Inc.",-,"108 La Casa Via Suite 102 Walnut Creek, Ca 94598-3013",Creek,CA,925-930-8465,New,-,"Kwon & Jabbour Dental, Inc.",Hani Jabbour - (president),07/15/2016,07/15/2016,Org
https://npidb.org/organizations/ambulatory_health_care/dental_261qd0000x/1053565564.aspx,"Kyu Lee Dmd,inc.",-,"810 Avenida Pico Suite W San Clemente, Ca 92673-5624",Clemente,CA,949-369-7200,New,-,"Kyu Lee Dmd,inc.",Kyu Lee - (president),11/11/2008,11/11/2008,Org
https://npidb.org/organizations/ambulatory_health_care/dental_261qd0000x/1033618152.aspx,L & H Dental Inc.,-,"20445 Prospect Rd Ste 7 San Jose, Ca 95129-4663",Jose,CA,408-252-8889,New,-,L & H Dental Inc.,Dai-chen Liu - (ceo),02/04/2018,02/04/2018,Org
https://npidb.org/organizations/ambulatory_health_care/dental_261qd0000x/1942835350.aspx,L J Vigliarolo Dds Corp,-,"310 N Citrus Ave Ste A Azusa, Ca 91702-3957",Azusa,CA,626-814-7715,New,-,L J Vigliarolo Dds Corp,Alenor Canlas - (manager),03/05/2020,03/05/2020,Org
https://npidb.org/organizations/ambulatory_health_care/federally-qualified-health-center-fqhc_261qf0400x/1326154360.aspx,La Clinica De La Raza--dental Lbn La Clinica De La Raza Inc,"A Federally Qualified Health Center (FQHC) is a community-based organization that provides comprehensive primary care and preventive care, including health, oral, and mental health/substance abuse services to persons of all ages, regardless of their ability to pay or health insurance status.","3050 E 16th St Oakland, Ca 94601-2319",Oakland,CA,510-535-4000,New,-,La Clinica De La Raza Inc,Jane Garcia - (chief Executive Officer),08/22/2006,10/26/2007,Org
https://npidb.org/organizations/ambulatory_health_care/federally-qualified-health-center-fqhc_261qf0400x/1346262292.aspx,La Clinica Dental At Children's Hospital Oakland Lbn La Clinica De La Raza Inc,"A Federally Qualified Health Center (FQHC) is a community-based organization that provides comprehensive primary care and preventive care, including health, oral, and mental health/substance abuse services to persons of all ages, regardless of their ability to pay or health insurance status.","4881 Telegraph Ave Oakland, Ca 94609-2009",Oakland,CA,510-428-3316,New,-,La Clinica De La Raza Inc,Jane Garcia - (chief Executive Officer),07/23/2006,02/06/2019,Org
https://npidb.org/organizations/ambulatory_health_care/federally-qualified-health-center-fqhc_261qf0400x/1538181482.aspx,La Clinica Monument Lbn La Clinica De La Raza Inc,"A Federally Qualified Health Center (FQHC) is a community-based organization that provides comprehensive primary care and preventive care, including health, oral, and mental health/substance abuse services to persons of all ages, regardless of their ability to pay or health insurance status.","2000 Sierra Road Concord, Ca 94518-2905",Concord,CA,925-363-2000,New,-,La Clinica De La Raza Inc,Jane Garcia - (chief Executive Officer),07/23/2006,01/28/2013,Org
https://npidb.org/organizations/ambulatory_health_care/federally-qualified-health-center-fqhc_261qf0400x/1528080470.aspx,La Clinica Pittsburg Dental Lbn La Clinica De La Raza Inc,"A Federally Qualified Health Center (FQHC) is a community-based organization that provides comprehensive primary care and preventive care, including health, oral, and mental health/substance abuse services to persons of all ages, regardless of their ability to pay or health insurance status.","339 E Leland Rd Pittsburg, Ca 94565-4911",Pittsburg,CA,925-431-1250,New,-,La Clinica De La Raza Inc,Jane Garcia - (chief Executive Officer),07/23/2006,10/29/2007,Org
https://npidb.org/organizations/ambulatory_health_care/federally-qualified-health-center-fqhc_261qf0400x/1780606632.aspx,La Clinica Vallejo Dental Lbn La Clinica De La Raza Inc,"A Federally Qualified Health Center (FQHC) is a community-based organization that provides comprehensive primary care and preventive care, including health, oral, and mental health/substance abuse services to persons of all ages, regardless of their ability to pay or health insurance status.","2920a Sonoma Blvd Vallejo, Ca 94590-3879",Vallejo,CA,707-558-2000,New,-,La Clinica De La Raza Inc,Jane Garcia - (chief Executive Officer),07/23/2006,08/22/2020,Org
https://npidb.org/organizations/ambulatory_health_care/dental_261qd0000x/1356743363.aspx,La Dental Care,-,"12820 Inglewood Ave Hawthorne, Ca 90250-5118",Hawthorne,CA,310-349-1980,New,-,La Dental Care,Shirin Rowhani - (dentist/ Owner),09/22/2014,09/22/2014,Org
https://npidb.org/organizations/ambulatory_health_care/dental_261qd0000x/1629244694.aspx,"La Jolla Shores Dental Lbn Lori J Nettleton D.d.s., Inc",-,"8100 Paseo Del Ocaso Suite A La Jolla, Ca 92037-3115",Jolla,CA,858-459-9772,New,-,"Lori J Nettleton D.d.s., Inc",Lori Nettleton - (doctor/owner),04/30/2008,09/14/2015,Org
https://npidb.org/organizations/ambulatory_health_care/dental_261qd0000x/1306340047.aspx,La Kids Dental Group Lbn Haig Mastikian Dmd Inc,-,"10835 Oxnard St North Hollywood, Ca 91606-5020",Hollywood,CA,818-945-9458,New,-,Haig Mastikian Dmd Inc,Haig Mastikian - (dentist),03/19/2018,06/28/2020,Org
https://npidb.org/organizations/ambulatory_health_care/dental_261qd0000x/1588170864.aspx,La Lux Dental Lbn Andrew Finley Dds Dental Corp,-,"8540 S Sepulveda Blvd Ste 800 Los Angeles, Ca 90045-3828",Angeles,CA,310-670-1200,New,-,Andrew Finley Dds Dental Corp,Andrew Finley - (president),12/21/2017,12/21/2017,Org
https://npidb.org/organizations/ambulatory_health_care/dental_261qd0000x/1053430710.aspx,La Maestra Family Clinic Inc.,-,"183 S 1st St El Cajon, Ca 92019-4795",Cajon,CA,619-328-1335,New,-,La Maestra Family Clinic Inc.,Alejandrina Areizaga - (coo),03/27/2007,08/22/2020,Org
https://npidb.org/organizations/ambulatory_health_care/dental_261qd0000x/1659490308.aspx,La Maestra Family Clinic Inc.,-,"4305 University Ave Suite 150 San Diego, Ca 92105-1645",Diego,CA,619-501-1235,New,-,La Maestra Family Clinic Inc.,Alejandrina Areizaga - (coo),03/27/2007,08/22/2020,Org
https://npidb.org/organizations/ambulatory_health_care/dental_261qd0000x/1548799182.aspx,"La Mesa Smiles & Family Dentistry Lbn Samer R. Namoo Dds, Inc",-,"8419 La Mesa Blvd Ste A La Mesa, Ca 91942-5381",Mesa,CA,(619) 464-3191,New,-,"Samer R. Namoo Dds, Inc",Samer Namoo - (president),06/07/2017,06/07/2017,Org
