https://npidb.org/organizations/ambulatory_health_care/dental_261qd0000x/1417437617.aspx,Dental Oasis Lbn Inku And Myung Dental Inc,-,"6818 S La Cienega Blvd Inglewood, Ca 90302-7272",Inglewood,CA,310-641-2220,New,-,Inku And Myung Dental Inc,Chris Myung - (president),08/16/2018,08/16/2018,Org
https://npidb.org/organizations/ambulatory_health_care/dental_261qd0000x/1194236018.aspx,Dental Office Of Downey Inc. Lbn Dental Office Of Downey Inc.,-,"10917 Paramounth Blvd Downey, Ca 90241",Downey,CA,562-659-7246,New,-,Dental Office Of Downey Inc.,Rodrick Ghadimi - (owner),10/18/2017,10/18/2017,Org
https://npidb.org/organizations/ambulatory_health_care/dental_261qd0000x/1285968164.aspx,Dental Office Lbn Z Kassab N Mubaraka Dds Inc,-,"9635 Milliken Ave Ste # 103 Rancho Cucamonga, Ca 91730-9004",Cucamonga,CA,909-481-8990,New,-,Z Kassab N Mubaraka Dds Inc,Ziad Kassab - (president),09/25/2009,09/25/2009,Org
https://npidb.org/organizations/ambulatory_health_care/dental_261qd0000x/1023489697.aspx,"Dental Offices Of Mahal, Inc.",-,"6030 S Land Park Dr Sacramento, Ca 95822-3315",Sacramento,CA,916-421-2200,New,-,"Dental Offices Of Mahal, Inc.",Narinderjit Mahal - (partner),10/08/2015,11/03/2017,Org
https://npidb.org/organizations/ambulatory_health_care/dental_261qd0000x/1043858582.aspx,"Dental Offices Of Travis Lee, Dds, Inc.",-,"11600 Wilshire Blvd Ste 10 Los Angeles, Ca 90025-1775",Angeles,CA,310-312-5070,New,-,"Dental Offices Of Travis Lee, Dds, Inc.",Travis Lee - (dentist),12/16/2019,12/16/2019,Org
https://npidb.org/organizations/ambulatory_health_care/dental_261qd0000x/1679062541.aspx,"Dental One, Denta Office Of Tokatli Denta Group Inc Lbn Tokatli Dental Group Inc",-,"1875 W La Habra Blvd La Habra, Ca 90631",Habra,CA,562-266-0033,New,-,Tokatli Dental Group Inc,Ahmad Tokatli - (president),05/07/2018,08/27/2018,Org
https://npidb.org/organizations/ambulatory_health_care/dental_261qd0000x/1851884373.aspx,"Dental Paradise Lbn Julio E Caceres Dds, Inc",-,"1104 W 17th St Santa Ana, Ca 92706-3506",Ana,CA,714-914-1887,New,-,"Julio E Caceres Dds, Inc",Julio Caceres - (ceo),06/09/2018,06/09/2018,Org
https://npidb.org/organizations/ambulatory_health_care/dental_261qd0000x/1992192058.aspx,Dental Plus Lbn John Cohen D D S Dental Corporation,-,"104 W Anaheim St Suite C Wilmington, Ca 90744-4488",Wilmington,CA,818-786-6000,New,-,John Cohen D D S Dental Corporation,John Cohen - (president/dentist),04/16/2015,09/02/2020,Org
https://npidb.org/organizations/ambulatory_health_care/dental_261qd0000x/1629546304.aspx,Dental Practice Of Jonah J Park Dds Inc,-,"7840 Firestone Blvd Ste 106 Downey, Ca 90241-4257",Downey,CA,562-923-0997,New,-,Dental Practice Of Jonah J Park Dds Inc,Jonah Park - (president),11/11/2018,05/01/2020,Org
https://npidb.org/organizations/ambulatory_health_care/dental_261qd0000x/1609390582.aspx,Dental Practice Of San Bernardino Lbn Myron L Massey Dds Inc,-,"322 N H St San Bernardino, Ca 92410-3224",Bernardino,CA,(909) 888-1301,New,-,Myron L Massey Dds Inc,Myron Massey - (president/owner),08/01/2017,08/01/2017,Org
https://npidb.org/organizations/ambulatory_health_care/dental_261qd0000x/1104156744.aspx,"Dental Source Of California Lbn Donald E. Clarke, D.d.s., Inc.",-,"1015 5th St Modesto, Ca 95351-2810",Modesto,CA,209-577-4263,New,-,"Donald E. Clarke, D.d.s., Inc.",Donald Clarke - (corporation President),01/04/2010,01/04/2010,Org
https://npidb.org/organizations/ambulatory_health_care/dental_261qd0000x/1144254756.aspx,"Dental Source Of California Lbn Donald E. Clarke, D.d.s., Inc.",-,"3901 Marconi Ave Sacramento, Ca 95821-3902",Sacramento,CA,916-487-7995,New,-,"Donald E. Clarke, D.d.s., Inc.",Donald Clarke - (corporation President),07/10/2006,01/04/2010,Org
https://npidb.org/organizations/ambulatory_health_care/dental_261qd0000x/1477883015.aspx,"Dental Source Of California Lbn Donald E. Clarke, D.d.s., Inc.",-,"3485 W Shaw Ave Suite #104 Fresno, Ca 93711-3212",Fresno,CA,559-276-7995,New,-,"Donald E. Clarke, D.d.s., Inc.",Donald Clarke - (corporation President),01/04/2010,01/04/2010,Org
https://npidb.org/organizations/ambulatory_health_care/dental_261qd0000x/1649295379.aspx,"Dental Source Of California Lbn Donald E. Clarke, D.d.s., Inc.",-,"1959 Zinfandel Dr Rancho Cordova, Ca 95670-2801",Cordova,CA,916-635-1457,New,-,"Donald E. Clarke, D.d.s., Inc.",Donald Clarke - (corporation President),07/13/2006,01/04/2010,Org
https://npidb.org/organizations/ambulatory_health_care/dental_261qd0000x/1972610046.aspx,"Dental Source Of California Lbn Donald E. Clarke, D.d.s., Inc.",-,"2200 Professional Dr Suite 210 Roseville, Ca 95661-7763",Roseville,CA,916-786-6157,New,-,"Donald E. Clarke, D.d.s., Inc.",Donald Clarke - (corpoation President),08/24/2006,01/04/2010,Org
https://npidb.org/organizations/ambulatory_health_care/dental_261qd0000x/1992720627.aspx,"Dental Source Of California Lbn Donald E. Clarke, D.d.s., Inc.",-,"5914 Stockton Blvd Sacramento, Ca 95824-3039",Sacramento,CA,916-393-7336,New,-,"Donald E. Clarke, D.d.s., Inc.",Donald Clarke - (president Of Corporation),07/13/2006,01/04/2010,Org
https://npidb.org/organizations/ambulatory_health_care/dental_261qd0000x/1760788392.aspx,Dental Spa On First Lbn Amin Sadeghi Dmd Inc,-,"4747 N 1st St Ste 109 Fresno, Ca 93726-0517",Fresno,CA,559-229-6249,New,-,Amin Sadeghi Dmd Inc,Aminollah Sadeghi - (president),01/29/2011,01/29/2011,Org
https://npidb.org/organizations/ambulatory_health_care/dental_261qd0000x/1649674581.aspx,Dental Studio Lbn Jacqueline Lopez Dds Inc,-,"12120 Saticoy St Ste. C North Hollywood, Ca 91605-3055",Hollywood,CA,818-255-2244,New,-,Jacqueline Lopez Dds Inc,Jacqueline Lopez - (dentist),10/21/2014,10/21/2014,Org
https://npidb.org/organizations/ambulatory_health_care/dental_261qd0000x/1316425804.aspx,Dental Studio Of Pasadena Lbn V. Paul Meserkhani,-,"2270 E Colorado Blvd Pasadena, Ca 91107-3656",Pasadena,CA,626-431-2930,New,-,V. Paul Meserkhani,Alenor Canlas - (director Of Operations),08/06/2018,08/06/2018,Org
https://npidb.org/organizations/ambulatory_health_care/dental_261qd0000x/1982947073.aspx,Dental Wear,-,"1401 E 4th St Suite A Long Beach, Ca 90802-1800",Beach,CA,562-279-5770,New,-,Dental Wear,Lydie Livolsi - (president),03/27/2013,03/27/2013,Org
https://npidb.org/organizations/ambulatory_health_care/dental_261qd0000x/1700083078.aspx,Dentalville,-,"5021 Florence Avenue Bell, Ca 90201",Bell,CA,323-560-1508,New,-,Dentalville,Evelyn Mckay - (office Manager),06/29/2007,08/22/2020,Org
https://npidb.org/organizations/ambulatory_health_care/dental_261qd0000x/1255972717.aspx,"Dentist Of Whittier Lbn Omid Hamid Barkhordar Dental, Inc",-,"16461 Whittier Blvd. Whittier, Ca 90603",Whittier,CA,562-242-3777,New,-,"Omid Hamid Barkhordar Dental, Inc",Omid Barkhordar - (owner),10/04/2019,01/21/2020,Org
https://npidb.org/organizations/ambulatory_health_care/dental_261qd0000x/1750716452.aspx,Dentist On Wheels Ca Lbn Maite Vargas Dental Corporation,-,"500 S Broadway Suite 246 Santa Maria, Ca 93454-5148",Maria,CA,855-369-8585,New,-,Maite Vargas Dental Corporation,Maite Vargas - (ceo),09/12/2013,09/12/2013,Org
https://npidb.org/organizations/ambulatory_health_care/dental_261qd0000x/1881844660.aspx,"Dentistry 2000 & Beyond, Inc.",-,"1708 Franklin St Oakland, Ca 94612-3408",Oakland,CA,510-465-7777,New,-,"Dentistry 2000 & Beyond, Inc.",Wendell Fudgen - (dentist/owner),09/29/2008,09/29/2008,Org
https://npidb.org/organizations/ambulatory_health_care/dental_261qd0000x/1255899647.aspx,Dentists Organized For Veterans,-,"1940 N Tracy Blvd Tracy, Ca 95376-2423",Tracy,CA,209-237-2151,New,-,Dentists Organized For Veterans,Angela Bayat - (owner),03/05/2019,03/05/2019,Org
https://npidb.org/organizations/ambulatory_health_care/dental_261qd0000x/1073627345.aspx,"Denture Center Lbn Walter F. Tickner, Dds, Inc.",-,"1736 E 14th St San Leandro, Ca 94577-4803",Leandro,CA,510-351-1400,New,-,"Walter F. Tickner, Dds, Inc.",Walter Tickner - (owner/dentist),08/17/2006,08/22/2020,Org
https://npidb.org/organizations/agencies/public-health-or-welfare_251k00000x/1326118829.aspx,Department Of Health And Human Services Lbn County Of Sacramento,-,"7001a East Pkwy Sacramento, Ca 95823-2501",Sacramento,CA,916-876-7950,Govt,-,County Of Sacramento,Lynn Frank - (director Of Dhhs),11/09/2006,08/22/2020,Org
https://npidb.org/organizations/ambulatory_health_care/clinic-center_261q00000x/1821129537.aspx,Department Of Public Health Lbn County Of Fresno,"A facility or distinct part of one used for the diagnosis and treatment of outpatients. ""Clinic/Center"" is irregularly defined, sometimes being limited to organizations serving specialized treatment requirements or distinct patient/client groups (e.g., radiology, poor, and public health).","1225 M St Correctional Health, 2nd Floor Fresno, Ca 93721-1805",Health,CA,559-600-9352,Govt,-,County Of Fresno,David Pomaville - (director),03/07/2007,05/15/2014,Org
https://npidb.org/organizations/ambulatory_health_care/dental_261qd0000x/1083244313.aspx,Derek H. Tang Dds Inc.,-,"640 Mill St Half Moon Bay, Ca 94019-1727",Bay,CA,650-726-7581,New,-,Derek H. Tang Dds Inc.,Derek Tang - (owner),01/26/2020,01/26/2020,Org
https://npidb.org/organizations/ambulatory_health_care/dental_261qd0000x/1376066977.aspx,Derek Hyun Dental Corp,-,"13025 Pomerado Rd Ste B Poway, Ca 92064-4248",Poway,CA,(858) 679-2838,New,-,Derek Hyun Dental Corp,Maricela Vizcarra - (office Manager),07/25/2017,07/26/2017,Org
https://npidb.org/organizations/ambulatory_health_care/dental_261qd0000x/1437627460.aspx,Derek K. Carson Dds Inc.,-,"126 W Deodar Ave Oxnard, Ca 93030",Oxnard,CA,805-983-0717,New,-,Derek K. Carson Dds Inc.,Derek Carson - (owner),11/07/2018,11/07/2018,Org
https://npidb.org/organizations/ambulatory_health_care/dental_261qd0000x/1699260448.aspx,"Designs In Dentistry Lbn Valentina Holina, Dmd, A Professional Dental Corporation",-,"100 Iron Point Cir Ste 102 Folsom, Ca 95630-8596",Folsom,CA,916-983-8360,New,-,"Valentina Holina, Dmd, A Professional Dental Corporation",Valentina Holina - (president),06/25/2018,06/25/2018,Org
https://npidb.org/organizations/ambulatory_health_care/dental_261qd0000x/1801443783.aspx,Desiree Liu Dds Inc,-,"490 Post St Ste 807 San Francisco, Ca 94102-1419",Francisco,CA,415-656-8076,New,-,Desiree Liu Dds Inc,Desiree Liu - (owner),08/24/2019,10/21/2019,Org
https://npidb.org/organizations/ambulatory_health_care/dental_261qd0000x/1104265958.aspx,Destiny Dental Implant Center,-,"6950 Destiny Dr Rocklin, Ca 95677-2987",Rocklin,CA,916-672-6377,New,-,Destiny Dental Implant Center,Esfandiar Abadi - (president),06/14/2013,06/14/2013,Org
https://npidb.org/organizations/ambulatory_health_care/dental_261qd0000x/1467867580.aspx,"Devin Anderson D,d.s.",-,"11261 Wareham Ct Loma Linda, Ca 92354-4875",Linda,CA,909-496-1718,New,-,"Devin Anderson D,d.s.",Devin Anderson - (dentist Anesthesiologist),06/26/2014,06/26/2014,Org
https://npidb.org/organizations/ambulatory_health_care/dental_261qd0000x/1235773508.aspx,"Dhanashri Nandavikar, Dds, Inc.",-,"2669a Cropley Ave San Jose, Ca 95132-3707",Jose,CA,408-942-0469,New,-,"Dhanashri Nandavikar, Dds, Inc.",Dhanashri Nandavikar - (ceo),10/30/2019,10/30/2019,Org
https://npidb.org/organizations/ambulatory_health_care/dental_261qd0000x/1205354354.aspx,"Dhs Dental Lbn Gun Gil Lee, Dds, Inc.",-,"66450 Pierson Blvd Desert Hot Springs, Ca 92240",Springs,CA,760-329-2191,New,-,"Gun Gil Lee, Dds, Inc.",Gun Gil Lee - (president),09/08/2017,05/24/2018,Org
https://npidb.org/organizations/ambulatory_health_care/dental_261qd0000x/1134602543.aspx,Diamond Bar Dental Lbn John Tchaboukian Dds Inc,-,"750 N Diamond Bar Blvd Diamond Bar, Ca 91765-1023",Bar,CA,909-860-3111,New,-,John Tchaboukian Dds Inc,John Tchaboukian - (dentist/owner),09/11/2018,07/11/2020,Org
https://npidb.org/organizations/ambulatory_health_care/dental_261qd0000x/1922580844.aspx,Diamond Lake Dental Lbn N Ozder Dds Inc,-,"250 S Lyon Ave Ste B Hemet, Ca 92543-3871",Hemet,CA,951-658-2354,New,-,N Ozder Dds Inc,Necdet Ozder - (ceo),09/06/2018,06/19/2020,Org
https://npidb.org/organizations/ambulatory_health_care/dental_261qd0000x/1427530161.aspx,Diamond Springs Dental Center Lbn A Westfall Dental Corporation,-,"540 Main St Diamond Springs, Ca 95619-9109",Springs,CA,530-600-2835,New,-,A Westfall Dental Corporation,April Westfall - (ceo),08/29/2018,08/29/2018,Org
https://npidb.org/organizations/ambulatory_health_care/dental_261qd0000x/1902364185.aspx,Diana Kim Dental Inc,-,"827 W Valley Blvd Colton, Ca 92324-2001",Colton,CA,909-825-2175,New,-,Diana Kim Dental Inc,Mayra Castellon - (secretary),03/07/2019,03/07/2019,Org
https://npidb.org/organizations/ambulatory_health_care/dental_261qd0000x/1770730608.aspx,"Dick S. Hoyos, D.d.s., Inc.",-,"9514 Reseda Blvd Suite 6 Northridge, Ca 91324-2308",Northridge,CA,818-775-1300,New,-,"Dick S. Hoyos, D.d.s., Inc.",Dick Hoyos - (president/owner),08/21/2008,08/21/2008,Org
https://npidb.org/organizations/ambulatory_health_care/dental_261qd0000x/1043629827.aspx,"Diep H. Le, Dds. Dental Corp Ii",-,"195 Meridian St A-5 Hollister, Ca 95023-2221",Hollister,CA,831-630-5720,New,-,"Diep H. Le, Dds. Dental Corp Ii",Diep Le - (dentist),08/06/2014,08/06/2014,Org
https://npidb.org/organizations/ambulatory_health_care/dental_261qd0000x/1497315550.aspx,Dinesh Makadia Dental Inc,-,"6270 Van Buren Blvd Riverside, Ca 92503-2024",Riverside,CA,951-603-3600,New,-,Dinesh Makadia Dental Inc,Dinesh Makadia - (owner),06/19/2019,06/19/2019,Org
https://npidb.org/organizations/ambulatory_health_care/dental_261qd0000x/1497151724.aspx,Ding Bu Dds Lbn Ding Bu Dds Dental Corp,-,"5546 Rosemead Blvd Suite 104 Temple City, Ca 91780-1845",City,CA,626-285-9808,New,-,Ding Bu Dds Dental Corp,Dean Bu - (president),11/13/2014,11/13/2014,Org
https://npidb.org/organizations/ambulatory_health_care/dental_261qd0000x/1902305469.aspx,Dinh Dental Corporation,-,"2619 W Edinger Ave Ste A3 Santa Ana, Ca 92704-3501",Ana,CA,714-751-4072,New,-,Dinh Dental Corporation,Robert Dinh - (ceo),02/09/2018,02/09/2018,Org
https://npidb.org/organizations/ambulatory_health_care/dental_261qd0000x/1114496270.aspx,Dino Javaheri Dds Inc,-,"400 El Cerro Blvd Ste 101 Danville, Ca 94526-1731",Danville,CA,925-837-5889,New,-,Dino Javaheri Dds Inc,Celina Garcia - (office Manager),11/19/2018,11/19/2018,Org
https://npidb.org/organizations/ambulatory_health_care/dental_261qd0000x/1285014274.aspx,"Dipa Cappelen, D.m.d., P.c.",-,"912 Grand Ave Ste 201 San Rafael, Ca 94901-3552",Rafael,CA,415-456-8735,New,-,"Dipa Cappelen, D.m.d., P.c.",Dipa Cappelen - (owner),06/04/2015,06/04/2015,Org
https://npidb.org/organizations/ambulatory_health_care/dental_261qd0000x/1063799310.aspx,Ditomasso Dental,-,"2619 J St Sacramento, Ca 95816-4312",Sacramento,CA,916-443-5677,New,-,Ditomasso Dental,Nikki Chauhan - (dentist),11/14/2011,11/14/2011,Org
https://npidb.org/organizations/ambulatory_health_care/dental_261qd0000x/1568730638.aspx,Ditomasso Dental,-,"2619 J St Sacramento, Ca 95816-4312",Sacramento,CA,916-443-5677,New,-,Ditomasso Dental,Stella Dariotis - (dentist),12/05/2011,12/05/2011,Org
https://npidb.org/organizations/ambulatory_health_care/dental_261qd0000x/1659934206.aspx,Diwan Dds Inc,-,"1204 Cottonwood St Ste No2 Woodland, Ca 95695-4362",Woodland,CA,408-373-7653,New,-,Diwan Dds Inc,Ritesh Diwan - (dentist),04/19/2019,04/16/2020,Org
https://npidb.org/organizations/ambulatory_health_care/dental_261qd0000x/1669826897.aspx,"Dodds Dental Lbn Drs. Emily & Dustin Dodds, A Professional Dental Corporation",-,"5580 E 2nd St Suite 202 Long Beach, Ca 90803-3946",Beach,CA,562-439-0754,New,-,"Drs. Emily & Dustin Dodds, A Professional Dental Corporation",Dustin Dodds - (owner/president),04/13/2016,04/13/2016,Org
https://npidb.org/organizations/ambulatory_health_care/dental_261qd0000x/1750896031.aspx,"Donald Anderson, Dds Inc",-,"3491 E Shields Ave Fresno, Ca 93726-6908",Fresno,CA,559-222-3300,New,-,"Donald Anderson, Dds Inc",Donald Anderson - (owner),12/07/2017,12/07/2017,Org
https://npidb.org/organizations/ambulatory_health_care/dental_261qd0000x/1962811349.aspx,Donald L Iman Dds Inc.,-,"23470 Olive Wood Plaza Dr Ste 170 Moreno Valley, Ca 92553-5267",Valley,CA,951-242-8426,New,-,Donald L Iman Dds Inc.,Donald Iman - (owner/ Ceo),08/11/2014,08/11/2014,Org
https://npidb.org/organizations/ambulatory_health_care/dental_261qd0000x/1669092011.aspx,"Donald Layus Dds, Inc.",-,"1412 San Andres St Ste D Santa Barbara, Ca 93101-4219",Barbara,CA,805-962-7471,New,-,"Donald Layus Dds, Inc.",Donald Layus - (president),04/24/2020,04/24/2020,Org
https://npidb.org/organizations/ambulatory_health_care/dental_261qd0000x/1164668315.aspx,Donald R Fleming D.d.s. Inc,-,"7676 Jackson Dr San Diego, Ca 92119-1500",Diego,CA,619-582-3600,New,-,Donald R Fleming D.d.s. Inc,Donald Fleming - (president),12/18/2008,12/18/2008,Org
https://npidb.org/organizations/ambulatory_health_care/dental_261qd0000x/1811267875.aspx,"Dori Dental Arts Lbn Dori & Dori, A Dental Company",-,"21031 Ventura Blvd Suite 101 Woodland Hills, Ca 91364-2203",Hills,CA,818-346-2000,New,-,"Dori & Dori, A Dental Company",Melissa Dori - (principal/dentist),01/09/2012,01/09/2012,Org
https://npidb.org/organizations/ambulatory_health_care/dental_261qd0000x/1811518988.aspx,Dorothy S Woo Dds Inc,-,"255 Laguna Rd Fullerton, Ca 92835-2515",Fullerton,CA,714-871-8838,New,-,Dorothy S Woo Dds Inc,Dorothy Woo - (president),04/30/2020,04/30/2020,Org
https://npidb.org/organizations/ambulatory_health_care/dental_261qd0000x/1598276495.aspx,Dossantos Dental Lbn Mauricio Dossantos Dds Inc.,-,"12033 4th St Yucaipa, Ca 92399-2755",Yucaipa,CA,909-790-1951,New,-,Mauricio Dossantos Dds Inc.,Esther Ramirez - (office Manager),10/18/2017,10/18/2017,Org
https://npidb.org/doctors/ambulatory_health_care/dental_261qd0000x/1174046429.aspx,Donald Douglasdental,"Profile for DONALD DOUGLAS in TARZANA, CA.","18646 Oxnard St Tarzana, Ca 91356-1411",Tarzana,CA,818-654-3845,New,-,-,s-Donald Douglasdental-Active,07/19/2017,07/19/2017,Sole
https://npidb.org/organizations/ambulatory_health_care/dental_261qd0000x/1447553573.aspx,"Douglas B. Weber, Dds, A Dental Incorporation",-,"44404 16th St W Suite 201 Lancaster, Ca 93534-2839",Lancaster,CA,661-945-3661,New,-,"Douglas B. Weber, Dds, A Dental Incorporation",Douglas Weber - (president/ceo),12/12/2010,12/12/2010,Org
https://npidb.org/organizations/ambulatory_health_care/dental_261qd0000x/1275753915.aspx,"Douglas J. Fossett, Dds",-,"8770 Cuyamaca St Suite 1 Santee, Ca 92071-4373",Santee,CA,619-448-8387,New,-,"Douglas J. Fossett, Dds",Douglas Fossett - (dentist),04/26/2007,08/22/2020,Org
https://npidb.org/organizations/ambulatory_health_care/dental_261qd0000x/1861989758.aspx,Downey Family Cosmetic Dentistry,-,"9212 Lakewood Blvd Downey, Ca 90280",Downey,CA,562-320-8414,New,-,Downey Family Cosmetic Dentistry,Cristina Gonzalez - (biller),04/17/2018,01/15/2020,Org
https://npidb.org/organizations/ambulatory_health_care/dental_261qd0000x/1437380300.aspx,Downtown Dental Benica,-,"172 East D Street Benicia, Ca 94510",Benicia,CA,707-745-3820,Govt,-,Downtown Dental Benica,Jack Elder - (president),07/27/2009,07/27/2009,Org
https://npidb.org/organizations/ambulatory_health_care/dental_261qd0000x/1679020309.aspx,"Downtown Dental Lemoore Lbn Pearl Dental & Medical Services, Inc",-,"210 Heinlen St Lemoore, Ca 93245-2947",Lemoore,CA,559-924-5353,Govt,-,"Pearl Dental & Medical Services, Inc",Mehdi Jafarinejad - (president),09/11/2016,09/11/2016,Org
https://npidb.org/organizations/ambulatory_health_care/dental_261qd0000x/1629353255.aspx,"Downtown Dental Practice Of Maria Paz S. David,d.m.d.,inc. Lbn Maria Paz S. David,d.m.d.,inc.",-,"2300 First St Ste 106 Livermore, Ca 94550-3141",Livermore,CA,925-337-5531,Govt,-,"Maria Paz S. David,d.m.d.,inc.",Maria David - (president),10/14/2011,10/14/2011,Org
https://npidb.org/organizations/ambulatory_health_care/dental_261qd0000x/1598019036.aspx,"Dr. A. Chang Dds, Inc",-,"6850 Lincoln Ave Ste 101 Buena Park, Ca 90620-4179",Park,CA,714-995-6000,New,-,"Dr. A. Chang Dds, Inc",Alicia Chang - (director),11/06/2012,11/06/2012,Org
https://npidb.org/organizations/ambulatory_health_care/dental_261qd0000x/1295890994.aspx,"Dr. Alice P. Moran, Dmd, Apc",-,"1001 Avenida Pico Suite K San Clemente, Ca 92673-6957",Clemente,CA,949-361-4867,New,-,"Dr. Alice P. Moran, Dmd, Apc",Alice Moran - (president),12/25/2006,02/11/2011,Org
https://npidb.org/organizations/ambulatory_health_care/dental_261qd0000x/1194243162.aspx,Dr Andrew Tibbitts Dds Lbn Tibbitts Dds & Associates,-,"40710 California Oaks Rd Ste B Murrieta, Ca 92562-1950",Murrieta,CA,(951) 677-5113,New,-,Tibbitts Dds & Associates,Valerie Rogers - (office Assistant),08/30/2017,08/30/2017,Org
https://npidb.org/organizations/ambulatory_health_care/dental_261qd0000x/1285075960.aspx,Dr Aqeela Syeda Shah Dds Inc,-,"3839 W 1st St B-1 Santa Ana, Ca 92703-4075",Ana,CA,714-554-5062,New,-,Dr Aqeela Syeda Shah Dds Inc,Aqeela Shah - (president),07/10/2013,07/10/2013,Org
https://npidb.org/organizations/ambulatory_health_care/dental_261qd0000x/1336604065.aspx,"Dr. Bayaz, Dds, Inc.",-,"44841 10th St W Lancaster, Ca 93534-2311",Lancaster,CA,661-948-1655,New,-,"Dr. Bayaz, Dds, Inc.",Abdul Bayaz - (president),02/06/2019,02/06/2019,Org
https://npidb.org/organizations/ambulatory_health_care/dental_261qd0000x/1265419766.aspx,Dr Chen & Dr Ho Dental Office Lbn Chen & Ho Dental Corp,-,"210 N Garfield Ave Suite 202 Monterey Park, Ca 91754",Park,CA,626-571-6023,New,-,Chen & Ho Dental Corp,Hong-jeng Chen - (general Dentist),12/27/2005,08/22/2020,Org
https://npidb.org/organizations/ambulatory_health_care/dental_261qd0000x/1821390071.aspx,Dr. D. Dental,-,"10451 Bolsa Ave Ste 110 Westminster, Ca 92683-6756",Westminster,CA,714-839-3636,New,-,Dr. D. Dental,Daniel Tran - (business Owner),11/20/2010,11/20/2010,Org
https://npidb.org/organizations/ambulatory_health_care/dental_261qd0000x/1457978405.aspx,Dr De Lormes Dental Group Inc,-,"26302 La Paz Road Suite 108 Mission Viejo, Ca 92691",Viejo,CA,949-581-5800,New,-,Dr De Lormes Dental Group Inc,John Delorme - (owner / President),06/25/2020,06/25/2020,Org
https://npidb.org/organizations/ambulatory_health_care/dental_261qd0000x/1184132714.aspx,Dr Deza Rolando Dds Pc,-,"920 N State St Hemet, Ca 92543-1473",Hemet,CA,951-652-0056,New,-,Dr Deza Rolando Dds Pc,Abraham Deza Rolando - (dentist/ Director),01/17/2018,01/17/2018,Org
https://npidb.org/organizations/ambulatory_health_care/dental_261qd0000x/1548612856.aspx,Dr. Deza's Dental Office Inc.,-,"23080 Alessandro Blvd Ste 201 Moreno Valley, Ca 92553-9674",Valley,CA,951-697-0909,New,-,Dr. Deza's Dental Office Inc.,Rocio Deza - (dentist/owner),07/11/2016,07/11/2016,Org
https://npidb.org/organizations/ambulatory_health_care/dental_261qd0000x/1548470107.aspx,Dr. Dhanesh R Pore Dds Inc,-,"29910 Murrieta Hot Springs Rd Suite R Murrieta, Ca 92563",Murrieta,CA,951-677-9104,New,-,Dr. Dhanesh R Pore Dds Inc,Dhanesh Pore - (owner),05/23/2007,08/22/2020,Org
https://npidb.org/organizations/ambulatory_health_care/dental_261qd0000x/1134637499.aspx,Dr. Edgardo S Rubio Dmd Corp Lbn Edgardo S Rubio Dmd Corp,-,"4131 Macdonald Ave Richmond, Ca 94805-2333",Richmond,CA,510-730-3949,New,-,Edgardo S Rubio Dmd Corp,Edgardo Rubio - (owner),01/19/2018,04/19/2019,Org
https://npidb.org/organizations/ambulatory_health_care/dental_261qd0000x/1639634728.aspx,Dr Fina Yvette Madrid Dds Pc,-,"3078 University Ave San Diego, Ca 92104-3034",Diego,CA,619-295-8891,New,-,Dr Fina Yvette Madrid Dds Pc,Fina Madrid - (president),02/04/2019,02/04/2019,Org
https://npidb.org/organizations/ambulatory_health_care/dental_261qd0000x/1912383845.aspx,Dr Flores Family Dental Office Professional Corporation,-,"1585 W Redlands Blvd Redlands, Ca 92373-8023",Redlands,CA,909-792-0071,New,-,Dr Flores Family Dental Office Professional Corporation,Jesus Flores - (president),08/03/2015,08/03/2015,Org
https://npidb.org/organizations/ambulatory_health_care/dental_261qd0000x/1578022323.aspx,"Dr. Frederick A. Johnson Jr Dds, Inc",-,"508 S Harbor Blvd Fullerton, Ca 92832-2411",Fullerton,CA,714-770-0455,New,-,"Dr. Frederick A. Johnson Jr Dds, Inc",Frederick Johnson - (dentist),03/19/2019,04/09/2019,Org
https://npidb.org/organizations/ambulatory_health_care/dental_261qd0000x/1669940953.aspx,Dr. Garcia-rojas D.d.s. Inc.,-,"10 Willow St Ste 6 Mill Valley, Ca 94941-2895",Valley,CA,415-388-6100,New,-,Dr. Garcia-rojas D.d.s. Inc.,Gabriela Garcia-rojas - (dds-business Owner),11/05/2018,11/05/2018,Org
https://npidb.org/organizations/ambulatory_health_care/dental_261qd0000x/1316187792.aspx,Dr Gediz Barnar,-,"25982 Pala Ste 110 Mission Viejo, Ca 92691-6724",Viejo,CA,949-454-7474,New,-,Dr Gediz Barnar,Gediz Barnar - (owner/doctor),02/25/2009,02/25/2009,Org
https://npidb.org/organizations/ambulatory_health_care/dental_261qd0000x/1508278797.aspx,"Dr. Hansung Bryan Kim, Dds Inc.",-,"2727 W Olympic Blvd Ste 311 Los Angeles, Ca 90006-2637",Angeles,CA,213-365-2360,New,-,"Dr. Hansung Bryan Kim, Dds Inc.",Han Kim - (president),05/22/2014,05/22/2014,Org
https://npidb.org/organizations/ambulatory_health_care/dental_261qd0000x/1528534963.aspx,Dr Huang's Dental Corp,-,"15724 E Gale Av Hacienda Heights, Ca 91745",Heights,CA,626-333-5244,New,-,Dr Huang's Dental Corp,Phillip Huang - (dds),10/23/2018,10/23/2018,Org
https://npidb.org/organizations/ambulatory_health_care/dental_261qd0000x/1194999219.aspx,Dr. Hwa Youn Kim D.d.s. Inc.,-,"3307 Alta Arden Expy Sacramento, Ca 95825-2102",Sacramento,CA,916-974-1819,New,-,Dr. Hwa Youn Kim D.d.s. Inc.,Hwa Kim - (president),04/18/2008,06/16/2008,Org
https://npidb.org/organizations/ambulatory_health_care/dental_261qd0000x/1558608851.aspx,Dr. I Liu Dental Corp,-,"860 E Remington Dr Ste. H Sunnyvale, Ca 94087-2995",Sunnyvale,CA,408-730-0888,New,-,Dr. I Liu Dental Corp,Iping Liu - (president),01/08/2013,01/08/2013,Org
